{
  "mova_version": "3.3.0",
  "payload_media_type": "application/ld+json",
  "payload": {
    "@context": {
      "@vocab": "https://schema.org/",
      "@language": "uk"
    },
    "@type": "Event",
    "name": "Стрижка — класика"
  },
  "actions": [
    {
      "type": "print",
      "message": "Готую JSON-LD"
    }
  ]
}